<?xml version="1.0" encoding="UTF-8"?>
<xs:schema xmlns:xs="http://www.w3.org/2001/XMLSchema">

    <xs:element name="extractedinfo">

        <xs:complexType>

            <xs:sequence maxOccurs="unbounded">
                <xs:element name="infotype">
                    <xs:complexType>
                        <xs:sequence>
                            <xs:element maxOccurs="unbounded" minOccurs="0" name="hit">
                                <xs:complexType>
                                    <xs:sequence>
                                        <xs:element name="value" type="xs:string"/>
                                        <xs:element name="details" minOccurs="0">
                                            <xs:complexType>
                                                <xs:sequence>
                                                  <xs:element name="part" maxOccurs="unbounded">
                                                  <xs:complexType>
                                                  <xs:simpleContent>
                                                  <xs:extension base="xs:string">
                                                  <xs:attribute name="name" type="xs:string"/>
                                                  </xs:extension>
                                                  </xs:simpleContent>
                                                  </xs:complexType>
                                                  </xs:element>
                                                </xs:sequence>
                                            </xs:complexType>
                                        </xs:element>
                                        <xs:element name="context" type="xs:string"/>
                                    </xs:sequence>
                                </xs:complexType>
                            </xs:element>
                        </xs:sequence>
                        <xs:attribute name="name" type="xs:string"/>
                    </xs:complexType>
                </xs:element>
            </xs:sequence>
        </xs:complexType>
    </xs:element>


</xs:schema>
